{
  "$schema": "https://json-schema.org/draft/2020-12/schema",
  "$id": "https://fixoa.github.io/crackspread/schemas/summary.schema.json",
  "title": "summary.json",
  "description": "\"What changed today\" box: LLM or rule-based (ARCHITECTURE §3.5).",
  "type": "object",
  "required": ["schema_version", "generated_at", "as_of", "fetched_at", "stale", "source", "source_url",
               "provider", "model", "fallback", "headline", "what_changed", "quips", "crack_o_meter"],
  "properties": {
    "schema_version": {"const": 1},
    "generated_at": {"$ref": "#/$defs/timestamp"},
    "as_of": {"$ref": "#/$defs/as_of_or_null"},
    "fetched_at": {"$ref": "#/$defs/timestamp"},
    "stale": {"type": "boolean"},
    "source": {"type": "string", "minLength": 1},
    "source_url": {"$ref": "#/$defs/url"},
    "provider": {"type": "string", "enum": ["gemini", "anthropic", "none"]},
    "model": {"type": "string"},
    "fallback": {"type": "boolean"},
    "headline": {"type": "string", "minLength": 1, "maxLength": 90},
    "what_changed": {
      "type": "array",
      "minItems": 3,
      "maxItems": 5,
      "items": {
        "type": "object",
        "required": ["text", "sources"],
        "properties": {
          "text": {"type": "string", "minLength": 1, "maxLength": 220},
          "sources": {"type": "array", "minItems": 1, "items": {"$ref": "#/$defs/url"}}
        },
        "additionalProperties": true
      }
    },
    "quips": {
      "type": "array",
      "maxItems": 2,
      "items": {"type": "string", "maxLength": 120, "pattern": "^[^0-9]*$"}
    },
    "crack_o_meter": {
      "type": "object",
      "required": ["level", "label"],
      "properties": {
        "level": {"anyOf": [{"type": "integer", "minimum": 0, "maximum": 4}, {"type": "null"}]},
        "label": {"type": ["string", "null"]},
        "percentile": {"type": ["number", "null"]},
        "value": {"type": ["number", "null"]},
        "unit": {"type": "string"},
        "as_of": {"$ref": "#/$defs/as_of_or_null"},
        "stale": {"type": "boolean"}
      },
      "additionalProperties": true
    },
    "deltas": {
      "type": "object",
      "additionalProperties": {
        "type": "object",
        "properties": {
          "now": {"type": ["number", "null"]},
          "prev": {"type": ["number", "null"]},
          "delta": {"type": ["number", "null"]},
          "as_of": {"$ref": "#/$defs/as_of_or_null"},
          "prev_as_of": {"$ref": "#/$defs/as_of_or_null"},
          "unit": {"type": "string"}
        },
        "additionalProperties": true
      }
    },
    "inputs_digest": {"type": ["string", "null"]}
  },
  "additionalProperties": true,
  "$defs": {
    "timestamp": {"type": "string", "pattern": "^\\d{4}-\\d{2}-\\d{2}T\\d{2}:\\d{2}:\\d{2}Z$"},
    "as_of": {"type": "string", "pattern": "^\\d{4}-\\d{2}(-\\d{2}(T\\d{2}:\\d{2}:\\d{2}Z)?)?$"},
    "as_of_or_null": {"anyOf": [{"$ref": "#/$defs/as_of"}, {"type": "null"}]},
    "url": {"type": "string", "pattern": "^https?://\\S+$"}
  }
}
