{
 "as_of": "2026-10-21T08:30:00Z",
 "crack_o_meter": {
  "as_of": "2026-10-14",
  "label": "Grand Canyon",
  "level": 4,
  "percentile": 98.5,
  "stale": true,
  "unit": "USD/bbl",
  "value": 86.222
 },
 "deltas": {
  "brent": {
   "as_of": "2026-10-14",
   "delta": 0.0,
   "now": 126.55,
   "prev": 126.55,
   "prev_as_of": "2026-10-14",
   "unit": "USD/bbl"
  },
  "brent_wti_spread": {
   "as_of": "2026-10-14",
   "delta": 0.0,
   "now": 24.64,
   "prev": 24.64,
   "prev_as_of": "2026-10-14",
   "unit": "USD/bbl"
  },
  "crack_321": {
   "as_of": "2026-10-14",
   "delta": 0.0,
   "now": 52.65,
   "prev": 52.65,
   "prev_as_of": "2026-10-14",
   "unit": "USD/bbl"
  },
  "diesel_crack": {
   "as_of": "2026-10-14",
   "delta": 0.0,
   "now": 86.222,
   "prev": 86.222,
   "prev_as_of": "2026-10-14",
   "unit": "USD/bbl"
  },
  "gasoline_crack": {
   "as_of": "2026-10-14",
   "delta": 0.0,
   "now": -1.096,
   "prev": -1.096,
   "prev_as_of": "2026-10-14",
   "unit": "USD/bbl"
  },
  "gasoline_nyh": {
   "as_of": "2026-10-14",
   "delta": 0.0,
   "now": 2.987,
   "prev": 2.987,
   "prev_as_of": "2026-10-14",
   "unit": "USD/gal"
  },
  "heating_oil_nyh": {
   "as_of": "2026-10-14",
   "delta": 0.0,
   "now": 4.834,
   "prev": 4.834,
   "prev_as_of": "2026-10-14",
   "unit": "USD/gal"
  },
  "jet_crack": {
   "as_of": "2026-10-14",
   "delta": 0.0,
   "now": 65.054,
   "prev": 65.054,
   "prev_as_of": "2026-10-14",
   "unit": "USD/bbl"
  },
  "jet_gulf": {
   "as_of": "2026-10-14",
   "delta": 0.0,
   "now": 4.562,
   "prev": 4.562,
   "prev_as_of": "2026-10-14",
   "unit": "USD/gal"
  },
  "retail_diesel_us": {
   "as_of": "2026-10-19",
   "delta": 0.0,
   "now": 6.276,
   "prev": 6.276,
   "prev_as_of": "2026-10-19",
   "unit": "USD/gal"
  },
  "retail_gasoline_us": {
   "as_of": "2026-10-19",
   "delta": 0.0,
   "now": 4.284,
   "prev": 4.284,
   "prev_as_of": "2026-10-19",
   "unit": "USD/gal"
  },
  "steo_consumption": {
   "as_of": "2026-10-06",
   "delta": 0.0,
   "now": 102.78,
   "period": "2026-10",
   "prev": 102.78,
   "prev_as_of": "2026-10-06",
   "unit": "million barrels per day"
  },
  "steo_production": {
   "as_of": "2026-10-06",
   "delta": 0.0,
   "now": 102.1,
   "period": "2026-10",
   "prev": 102.1,
   "prev_as_of": "2026-10-06",
   "unit": "million barrels per day"
  },
  "steo_stock_draw": {
   "as_of": "2026-10-06",
   "delta": 0.0,
   "now": 0.67,
   "period": "2026-10",
   "prev": 0.67,
   "prev_as_of": "2026-10-06",
   "unit": "million barrels per day"
  },
  "ulsd_nyh": {
   "as_of": "2026-10-14",
   "delta": 0.0,
   "now": 5.066,
   "prev": 5.066,
   "prev_as_of": "2026-10-14",
   "unit": "USD/gal"
  },
  "wti": {
   "as_of": "2026-10-14",
   "delta": 0.0,
   "now": 101.91,
   "prev": 101.91,
   "prev_as_of": "2026-10-14",
   "unit": "USD/bbl"
  }
 },
 "fallback": true,
 "fetched_at": "2026-10-21T08:31:41Z",
 "generated_at": "2026-10-21T08:31:41Z",
 "headline": "Diesel crack: no fresh FRED data, last value $86.22/bbl (as of 2026-10-14)",
 "inputs_digest": "906744eff7131cda276b9d47a630302d843f5442",
 "model": "",
 "provider": "none",
 "quips": [],
 "schema_version": 1,
 "source": "Crackspread rule-based summary (no AI)",
 "source_url": "https://github.com/fixoa/crackspread",
 "stale": false,
 "what_changed": [
  {
   "sources": [
    "https://oilprice.com/Latest-Energy-News/World-News/Indias-Coal-Crisis-Deepens-as-Power-Demand-Surges.html"
   ],
   "text": "India’s Coal Crisis Deepens as Power Demand Surges"
  },
  {
   "sources": [
    "https://splash247.com/shipping-equities-turn-geopolitical-risk-into-an-advantage/"
   ],
   "text": "Shipping equities turn geopolitical risk into an advantage"
  },
  {
   "sources": [
    "https://news.google.com/rss/articles/CBMijwFBVV95cUxOREpSUDl2ektaT0dlakdnczdPR203cHlKRXNvWnVjdjRrWURCSUctZnpMMHQ1X21Pcmk4S0lTaDFrUWZpRl9HNGNNOVlWb2FnaHQ2ZnZ0d0VQaEtNMFQ5S0t5cEJwa0lDMXZHNHVuVTg1NXNkUkFXYlppRmFsNms1d1dlQ0RwU1F6Y2xidEE0cw?oc=5"
   ],
   "text": "Preventing the risk of conflict in Yemen escalating and threatening maritime security."
  },
  {
   "sources": [
    "https://news.google.com/rss/articles/CBMiggFBVV95cUxQbTlUeTlzWWtqUW9iMDNzOFQ1amNnR1ZOcGZDMnRvTVJXV0FSS1BraEJtekdsYjhKUXF6RXA2Y202LVI0UFRxdFhaVmN2N21wMGJvdFdrYndrd3pDUGd1Q1RRcHAwaG4yOW1XWTdPZUc4a2lZNnlQTXBqck1ZZVdIc3VR?oc=5"
   ],
   "text": "Several feared dead in Meru quarry collapse"
  },
  {
   "sources": [
    "https://splash247.com/nato-boosts-black-sea-surveillance-amid-attacks-on-shipping/"
   ],
   "text": "NATO boosts Black Sea surveillance amid attacks on shipping"
  }
 ]
}
